{
  "schemaVersion": 1,
  "version": "branch_row_mapping_v1",
  "stateContractPath": "contracts/state-transition/state_transition_contract_v1.json",
  "gameEndContractPath": "contracts/state-transition/game_end_contract_v1.json",
  "fixtureCoveragePath": "contracts/state-transition/manual_fixture_branch_coverage_v1.json",
  "expectedPositiveMatches": 24,
  "expectedNegativeMatches": 11,
  "expectedRegisterBranches": 69,
  "expectedExcludedBranches": 34,
  "claimBoundary": {
    "machineVerified": [
      "分岐IDの台帳実在、fixture 35 分岐との exact-set および免除 34 分岐との整合",
      "自然キーによる規範行の一意な実在と、状況判定契約の既存行参照との一致",
      "通常fixtureの入力述語・期待値と規範行の一致、交差制約負例の変異の存在",
      "終了判定行自身のbranchIdを正とした対応表との一致、入力述語および期待decisionとの一致",
      "fixture典拠と台帳のsourceClauseIdsに共通の典拠があること"
    ],
    "notGuaranteed": [
      "分岐条文の意味と選んだ規範行との意味的対応は構造検査だけでは証明できず、人間の逐行確認を要する",
      "交差制約負例の拒否IDと違反集合の照合は展開結果照合検査器が担当する",
      "対応表自身は凍結済み手作業fixtureのbaseline_control射影に含まれず、digest凍結されていない"
    ]
  },
  "mappings": [
    {
      "branchId": "SO-01",
      "rowRef": {
        "layer": "matrixRows",
        "coordinate": {
          "eventKind": "batting-result",
          "resultId": "batting-result.called-strikeout",
          "precondition": {
            "op": "and",
            "args": [
              {
                "op": "eq",
                "axisId": "state.outs",
                "value": 0
              },
              {
                "op": "eq",
                "axisId": "state.runners",
                "value": "empty"
              },
              {
                "op": "eq",
                "axisId": "state.count.strikes",
                "value": 2
              },
              {
                "op": "eq",
                "axisId": "state.count.balls",
                "value": 0
              },
              {
                "op": "eq",
                "axisId": "event.perPitch.pitchEventKind",
                "value": "pitch-event"
              }
            ]
          }
        }
      },
      "fixtureRelation": "row-output"
    },
    {
      "branchId": "SO-02",
      "rowRef": {
        "layer": "matrixRows",
        "coordinate": {
          "eventKind": "batting-result",
          "resultId": "batting-result.swinging-strikeout",
          "precondition": {
            "op": "and",
            "args": [
              {
                "op": "eq",
                "axisId": "state.outs",
                "value": 0
              },
              {
                "op": "eq",
                "axisId": "state.runners",
                "value": "empty"
              },
              {
                "op": "eq",
                "axisId": "state.count.strikes",
                "value": 2
              },
              {
                "op": "eq",
                "axisId": "state.count.balls",
                "value": 0
              },
              {
                "op": "eq",
                "axisId": "event.perPitch.pitchEventKind",
                "value": "pitch-event"
              }
            ]
          }
        }
      },
      "fixtureRelation": "row-output"
    },
    {
      "branchId": "SO-03",
      "rowRef": {
        "layer": "matrixRows",
        "coordinate": {
          "eventKind": "batting-result",
          "resultId": "batting-result.dropped-third-strike",
          "precondition": {
            "op": "and",
            "args": [
              {
                "op": "eq",
                "axisId": "state.outs",
                "value": 2
              },
              {
                "op": "eq",
                "axisId": "state.runners",
                "value": "empty"
              },
              {
                "op": "eq",
                "axisId": "state.count.strikes",
                "value": 2
              },
              {
                "op": "eq",
                "axisId": "state.count.balls",
                "value": 0
              },
              {
                "op": "eq",
                "axisId": "event.perPitch.pitchEventKind",
                "value": "pitch-event"
              }
            ]
          }
        }
      },
      "fixtureRelation": "row-output"
    },
    {
      "branchId": "SO-04",
      "rowRef": {
        "layer": "matrixRows",
        "coordinate": {
          "eventKind": "batting-result",
          "resultId": "batting-result.k3",
          "precondition": {
            "op": "and",
            "args": [
              {
                "op": "eq",
                "axisId": "state.outs",
                "value": 0
              },
              {
                "op": "eq",
                "axisId": "state.runners",
                "value": "empty"
              },
              {
                "op": "eq",
                "axisId": "state.count.strikes",
                "value": 2
              },
              {
                "op": "eq",
                "axisId": "state.count.balls",
                "value": 0
              },
              {
                "op": "eq",
                "axisId": "event.perPitch.pitchEventKind",
                "value": "pitch-event"
              }
            ]
          }
        }
      },
      "fixtureRelation": "row-output"
    },
    {
      "branchId": "SO-05",
      "rowRef": {
        "layer": "matrixRows",
        "coordinate": {
          "eventKind": "batting-result",
          "resultId": "batting-result.strikeout-double-play",
          "precondition": {
            "op": "and",
            "args": [
              {
                "op": "eq",
                "axisId": "state.outs",
                "value": 1
              },
              {
                "op": "eq",
                "axisId": "state.runners",
                "value": "first"
              },
              {
                "op": "eq",
                "axisId": "state.count.strikes",
                "value": 2
              },
              {
                "op": "eq",
                "axisId": "state.count.balls",
                "value": 0
              },
              {
                "op": "eq",
                "axisId": "event.perPitch.pitchEventKind",
                "value": "pitch-event"
              }
            ]
          }
        }
      },
      "fixtureRelation": "row-output"
    },
    {
      "branchId": "RBI-06",
      "rowRef": {
        "layer": "matrixRows",
        "coordinate": {
          "eventKind": "batting-result",
          "resultId": "batting-result.home-run",
          "precondition": {
            "op": "and",
            "args": [
              {
                "op": "eq",
                "axisId": "state.outs",
                "value": 0
              },
              {
                "op": "eq",
                "axisId": "state.runners",
                "value": "loaded"
              },
              {
                "op": "eq",
                "axisId": "state.count.strikes",
                "value": 0
              },
              {
                "op": "eq",
                "axisId": "state.count.balls",
                "value": 0
              },
              {
                "op": "eq",
                "axisId": "event.perPitch.pitchEventKind",
                "value": "pitch-event"
              }
            ]
          }
        }
      },
      "fixtureRelation": "row-output"
    },
    {
      "branchId": "RBI-08",
      "rowRef": {
        "layer": "matrixRows",
        "coordinate": {
          "eventKind": "batting-result",
          "resultId": "batting-result.sacrifice-fly",
          "precondition": {
            "op": "and",
            "args": [
              {
                "op": "eq",
                "axisId": "state.outs",
                "value": 0
              },
              {
                "op": "eq",
                "axisId": "state.runners",
                "value": "third"
              },
              {
                "op": "eq",
                "axisId": "state.count.strikes",
                "value": 0
              },
              {
                "op": "eq",
                "axisId": "state.count.balls",
                "value": 0
              },
              {
                "op": "eq",
                "axisId": "event.perPitch.pitchEventKind",
                "value": "pitch-event"
              }
            ]
          }
        }
      },
      "fixtureRelation": "row-output"
    },
    {
      "branchId": "RBI-09",
      "rowRef": {
        "layer": "matrixRows",
        "coordinate": {
          "eventKind": "secondary-result",
          "resultId": "secondary-result.passed-ball",
          "precondition": {
            "op": "and",
            "args": [
              {
                "op": "eq",
                "axisId": "state.outs",
                "value": 0
              },
              {
                "op": "eq",
                "axisId": "state.runners",
                "value": "loaded"
              },
              {
                "op": "eq",
                "axisId": "state.count.strikes",
                "value": 0
              },
              {
                "op": "eq",
                "axisId": "state.count.balls",
                "value": 0
              },
              {
                "op": "eq",
                "axisId": "event.perPitch.pitchEventKind",
                "value": "pitch-event"
              }
            ]
          }
        }
      },
      "fixtureRelation": "row-output"
    },
    {
      "branchId": "INT-02",
      "rowRef": {
        "layer": "matrixRows",
        "coordinate": {
          "eventKind": "secondary-result",
          "resultId": "secondary-result.batting-interference",
          "precondition": {
            "op": "and",
            "args": [
              {
                "op": "eq",
                "axisId": "state.outs",
                "value": 0
              },
              {
                "op": "eq",
                "axisId": "state.runners",